feedback_id,feedback,title,author_codes,channel,product_area,source_dataset
EndR_92Q8dxKR1Sm9J8J,"Be aware of  some ""toxic"" scientists around who may use this platform to black their colleages",Final open comment — cit384_5,pubpeer-misuse,open-ended survey (qualitative),Final open comment,Zenodo 10.5281/zenodo.20413424 — PubPeer perceptions (qualitative)
EndR_95zRYGrpV64hC9x,"When their studies were published, we attempted to replicate their findings but consistently obtained opposing results. This made it very challenging to publish our own work. This experience highlights the critical importance of platforms like PubPeer",Final open comment — cit385_5,reproducibility; pubpeer-ok,open-ended survey (qualitative),Final open comment,Zenodo 10.5281/zenodo.20413424 — PubPeer perceptions (qualitative)
EndR_9enngZQgoCe9wC5,"We think  issue such as ""conflict of interest"" is important. Authors, reviewers, or editors in chief need statements in this regard. After all, this is a matter of procedural justice. However, when it comes to a specific paper, more specific issues need to be considered before a judgement can be made.",Final open comment — cit386_5,other; to-be-discussed-group,open-ended survey (qualitative),Final open comment,Zenodo 10.5281/zenodo.20413424 — PubPeer perceptions (qualitative)
EndR_9JttgF3oO2wzIRq,"The manuscript which are commented by Pubpeers should have some flag in the journals websites on online links, so that authors who are refering to any such will be very careful in refering or citing. Pubpeers are in general is not used as tool for searching the related work",Final open comment — cit387_5,pubpeer-comment-visibility,open-ended survey (qualitative),Final open comment,Zenodo 10.5281/zenodo.20413424 — PubPeer perceptions (qualitative)
EndR_9LvVntQBWc4JJlX,"It is disappointing that more and more scientists produce fraudulent work for various reasons eg funding acquisition pressure, promotion, etc",Final open comment — cit328_5,fraud,open-ended survey (qualitative),Final open comment,Zenodo 10.5281/zenodo.20413424 — PubPeer perceptions (qualitative)
EndR_9mmVOzUpz9j6m7X,"There are also papers published since that report, which also support the claim we made in our own paper thus making the the relative contribution of the citation in question smaller.",Final open comment — cit388_5,no-serious-consequence,open-ended survey (qualitative),Final open comment,Zenodo 10.5281/zenodo.20413424 — PubPeer perceptions (qualitative)
EndR_9RkGqW17Lq7RHKf,"For a review paper, we just gave a summary about the conclusion that the different authors in literature made. The readers may distinguish the conclusion correct or not based on the later comments.",Final open comment — cit389_5,review-article,open-ended survey (qualitative),Final open comment,Zenodo 10.5281/zenodo.20413424 — PubPeer perceptions (qualitative)
EndR_9UrKVXVZopUT1e1,No Comments,Final open comment — com390_5,none,open-ended survey (qualitative),Final open comment,Zenodo 10.5281/zenodo.20413424 — PubPeer perceptions (qualitative)
EndR_9vw416zBjOv2cmJ,Thank you,Final open comment — com329_5,thanks,open-ended survey (qualitative),Final open comment,Zenodo 10.5281/zenodo.20413424 — PubPeer perceptions (qualitative)
EndR_9zHJhWMLci5ZXWs,PupPeers is not accurate and causes conflict with peers and the Journal. It should be more official and accurate so i can trust,Final open comment — cit391_5,pubpeer-not-ok; pubpeer-control,open-ended survey (qualitative),Final open comment,Zenodo 10.5281/zenodo.20413424 — PubPeer perceptions (qualitative)
Q4noButWillotherR_25vAXPcx1F3nos4,"I will look at whether the paper in question has any other comments elsewhere, whether others have replicated the findings and the track record of the team involved. I doubt I will contact the authors directly.","Not yet, but may use (other) — cit103_4",action-other; contacting-authors,open-ended survey (qualitative),"Not yet, but may use (other)",Zenodo 10.5281/zenodo.20413424 — PubPeer perceptions (qualitative)
Q4noButWillotherR_2GQSMe3c41ugicx,I have already answered to the pubpeer comment,"Not yet, but may use (other) — cit392_4",pb-fixed-on-pubpeer,open-ended survey (qualitative),"Not yet, but may use (other)",Zenodo 10.5281/zenodo.20413424 — PubPeer perceptions (qualitative)
Q4noButWillotherR_6YlU27gfqlu3LMQ,I did not need to respond to PubPeer so far.,"Not yet, but may use (other) — cit393_4",other,open-ended survey (qualitative),"Not yet, but may use (other)",Zenodo 10.5281/zenodo.20413424 — PubPeer perceptions (qualitative)
Q4noButWillotherR_7BPIhUDdykaCmqU,I am not sure what to do. do you have any suggestions?,"Not yet, but may use (other) — cit121_4",uncertain,open-ended survey (qualitative),"Not yet, but may use (other)",Zenodo 10.5281/zenodo.20413424 — PubPeer perceptions (qualitative)
Q4noButWillotherR_8JlWSnj5xsJtdkN,i will try to be even more attentive to details in the papers that i or my students cite in our papers... even in figures or text not relative to our direct work,"Not yet, but may use (other) — cit129_4",action-other; students,open-ended survey (qualitative),"Not yet, but may use (other)",Zenodo 10.5281/zenodo.20413424 — PubPeer perceptions (qualitative)
Q4noWontOtherR_1CdM4r7GlTtw8ik,Because the relevant comment has already been generated and I am sure the corresponding author will do the needful.,Why not use PubPeer (other) — cit394_2,correction-done,open-ended survey (qualitative),Why not use PubPeer (other),Zenodo 10.5281/zenodo.20413424 — PubPeer perceptions (qualitative)
Q4noWontOtherR_1DtGfA5SKHwIuMy,The identified issue was in one of the many citations in our publication and does not affect the findings and conclusions of our work.,Why not use PubPeer (other) — cit332_2,no-serious-consequence,open-ended survey (qualitative),Why not use PubPeer (other),Zenodo 10.5281/zenodo.20413424 — PubPeer perceptions (qualitative)
Q4noWontOtherR_1Em4MaARjWNhMF6,"The error was corrected in the official record. Correcting the error had no effect on the conclusions of the paper, so our reference remains correct.",Why not use PubPeer (other) — cit395_2,correction-done; no-serious-consequence,open-ended survey (qualitative),Why not use PubPeer (other),Zenodo 10.5281/zenodo.20413424 — PubPeer perceptions (qualitative)
Q4noWontOtherR_1mqm6KJewZAB6CJ,The focus is a trivial cherry picking. What matters is unaffected.,Why not use PubPeer (other) — cit396_2,no-serious-consequence; irrelevant-comment,open-ended survey (qualitative),Why not use PubPeer (other),Zenodo 10.5281/zenodo.20413424 — PubPeer perceptions (qualitative)
Q4noWontOtherR_1uX4yXEMnTRRsYH,It was an error in a representative electrophysiological traces. Although it is unfortunate it does not affect the conclusions of the study.,Why not use PubPeer (other) — cit397_2,no-serious-consequence,open-ended survey (qualitative),Why not use PubPeer (other),Zenodo 10.5281/zenodo.20413424 — PubPeer perceptions (qualitative)
Q4noWontOtherR_26mTWOAb2pVd18v,"as said before, the irregularities have been corrected already by the authors, so I don't see a need for action",Why not use PubPeer (other) — cit220_2,correction-done,open-ended survey (qualitative),Why not use PubPeer (other),Zenodo 10.5281/zenodo.20413424 — PubPeer perceptions (qualitative)
Q4noWontOtherR_27UTJHYSn9GfnKW,It is for the main and corresponding author of this paper to address this issue. I presume that this is where this experiment was done & hence this is the person who can address the issue,Why not use PubPeer (other) — cit398_2,responsibility-to-authors,open-ended survey (qualitative),Why not use PubPeer (other),Zenodo 10.5281/zenodo.20413424 — PubPeer perceptions (qualitative)
Q4noWontOtherR_2aaIbqhkFaeT2y9,already commented as the cited publication clearly state that the images are manipulated on purpose to provide example of misconduct (message of the paper),Why not use PubPeer (other) — cit104_2,irrelevant-comment,open-ended survey (qualitative),Why not use PubPeer (other),Zenodo 10.5281/zenodo.20413424 — PubPeer perceptions (qualitative)
Q4noWontOtherR_2CljCpdcM1KwmI0,It's not such a big error,Why not use PubPeer (other) — cit399_2,no-serious-consequence,open-ended survey (qualitative),Why not use PubPeer (other),Zenodo 10.5281/zenodo.20413424 — PubPeer perceptions (qualitative)
Q4noWontOtherR_2D2jP9XToWP8VMF,it is going to take my time to contact the publishers to and amend my article to publish the corrected version...it would have been more convenient if the publishers included PubPeer's comments along with the paper ...It is hard for authors to check all the papers if they are correct... or if they have been flagged by PubPeer,Why not use PubPeer (other) — cit222_2,time; pubpeer-comment-visibility,open-ended survey (qualitative),Why not use PubPeer (other),Zenodo 10.5281/zenodo.20413424 — PubPeer perceptions (qualitative)
Q4noWontOtherR_2Duop5JNoALqJct,"As said, it is an error in the figure's assembly. The authors have provided the correct one.",Why not use PubPeer (other) — cit400_2,correction-done,open-ended survey (qualitative),Why not use PubPeer (other),Zenodo 10.5281/zenodo.20413424 — PubPeer perceptions (qualitative)
Q4noWontOtherR_2DYSeZsIhacmPos,"The paper has been retracted. that speaks for itself.
When the article was written, this article was not very controversial (I believe, 9-10 years ago), but then shortly before our article was published, the pubpeer comments came out.",Why not use PubPeer (other) — cit401_2,retraction/retracted,open-ended survey (qualitative),Why not use PubPeer (other),Zenodo 10.5281/zenodo.20413424 — PubPeer perceptions (qualitative)
Q4noWontOtherR_2EuM6UKEpzlHbwc,"Our conclusions are not affected by the PubPeer comment on the other paper, which has been now retracted and can no longer cause damage to others.",Why not use PubPeer (other) — cit339_2,retraction/retracted; no-serious-consequence,open-ended survey (qualitative),Why not use PubPeer (other),Zenodo 10.5281/zenodo.20413424 — PubPeer perceptions (qualitative)
Q4noWontOtherR_2kNhEidjbrkOieV,"Our citation for this paper concerned a different aspect of the paper and in a conditional formatting. As this was in the setting of a review article, no experimentation or conclusions from our part have been jeopardized.",Why not use PubPeer (other) — cit402_2,review-article; no-serious-consequence; citation-reasons,open-ended survey (qualitative),Why not use PubPeer (other),Zenodo 10.5281/zenodo.20413424 — PubPeer perceptions (qualitative)
Q4noWontOtherR_2M4CERSxnjLShgF,The publication is retracted; that is sufficient.,Why not use PubPeer (other) — cit342_2,retraction/retracted; correction-done,open-ended survey (qualitative),Why not use PubPeer (other),Zenodo 10.5281/zenodo.20413424 — PubPeer perceptions (qualitative)
Q4noWontOtherR_2mI6y94CSGWl6Wh,as stated bfore the relevant results have been repeated and confirmed by independent studies.,Why not use PubPeer (other) — cit343_2,no-serious-consequence,open-ended survey (qualitative),Why not use PubPeer (other),Zenodo 10.5281/zenodo.20413424 — PubPeer perceptions (qualitative)
Q4noWontOtherR_2nygqcCSVoebbQ5,What should I do? The commenter just found some typos or plagiarism in the publication... I can't understand how this should impact my publication.,Why not use PubPeer (other) — cit403_2,no-serious-consequence; to-be-discussed-group; uncertain,open-ended survey (qualitative),Why not use PubPeer (other),Zenodo 10.5281/zenodo.20413424 — PubPeer perceptions (qualitative)
Q4noWontOtherR_2pGxxvmrt0PVX7H,"In my paper I was criticizing the same publication because in my expertise the technique they were using was not suitable for answering the question at hand.  In other words, the PubPeer evidence just are confirming my criticism/skepticism. So in reality my conclusion in the paper becomes even stronger.",Why not use PubPeer (other) — cit345_2,to-be-discussed-group; citation-reasons; relevant-comment,open-ended survey (qualitative),Why not use PubPeer (other),Zenodo 10.5281/zenodo.20413424 — PubPeer perceptions (qualitative)
Q4noWontOtherR_2qfmm9jLsAyTtC2,This point does not alter the facts that made me cite the paper,Why not use PubPeer (other) — cit237_2,no-serious-consequence,open-ended survey (qualitative),Why not use PubPeer (other),Zenodo 10.5281/zenodo.20413424 — PubPeer perceptions (qualitative)
Q4noWontOtherR_2QFTn5hvhBuhlaV,"The mistake has been corrected by authors, it did not affect their main conclusions, and neither the mistake nor the correction affected the conclusions in our work.",Why not use PubPeer (other) — cit238_2,correction-done; no-serious-consequence,open-ended survey (qualitative),Why not use PubPeer (other),Zenodo 10.5281/zenodo.20413424 — PubPeer perceptions (qualitative)
Q4noWontOtherR_2y1nWiKuc6HKsQ9,The issue has been resolved. No controversy remains,Why not use PubPeer (other) — cit46_2,correction-done,open-ended survey (qualitative),Why not use PubPeer (other),Zenodo 10.5281/zenodo.20413424 — PubPeer perceptions (qualitative)
Q4noWontOtherR_365Rqbnx0dr3Guq,Was not aware of the comment.,Why not use PubPeer (other) — cit404_2,other,open-ended survey (qualitative),Why not use PubPeer (other),Zenodo 10.5281/zenodo.20413424 — PubPeer perceptions (qualitative)
Q4noWontOtherR_39doRaZXApEh7T2,"The authors published a correction.
I am uncertain what more can be done.",Why not use PubPeer (other) — cit405_2,correction-done; uncertain,open-ended survey (qualitative),Why not use PubPeer (other),Zenodo 10.5281/zenodo.20413424 — PubPeer perceptions (qualitative)
Q4noWontOtherR_3atcj3iL82Wo2ml,"none of the observations rise to fraud or affect the conclusions of the paper.  many contributors to pub-peer are more interested in ""gotcha"" than in science.",Why not use PubPeer (other) — cit406_2,no-serious-consequence; not-fraud; other,open-ended survey (qualitative),Why not use PubPeer (other),Zenodo 10.5281/zenodo.20413424 — PubPeer perceptions (qualitative)
Q4noWontOtherR_3nkqAJoPbUs6CwI,I do not appreciate the vindicative tone of the comments on pubpeer.,Why not use PubPeer (other) — cit407_2,tone,open-ended survey (qualitative),Why not use PubPeer (other),Zenodo 10.5281/zenodo.20413424 — PubPeer perceptions (qualitative)
Q4noWontOtherR_3oh0gDMaRTfc9mF,It didn't change the conclusion.,Why not use PubPeer (other) — cit247_2,no-serious-consequence,open-ended survey (qualitative),Why not use PubPeer (other),Zenodo 10.5281/zenodo.20413424 — PubPeer perceptions (qualitative)
Q4noWontOtherR_3QezwnYqFJzk4lX,"The comment was answered satisfactorily. Had it not, I would remove this paper from my potential citations.",Why not use PubPeer (other) — cit74_2,pb-fixed-on-pubpeer; action-not-cite,open-ended survey (qualitative),Why not use PubPeer (other),Zenodo 10.5281/zenodo.20413424 — PubPeer perceptions (qualitative)
Q4noWontOtherR_3v2Jzy57EsrlX1y,I do not believe this comment identifies a major issue in the article.,Why not use PubPeer (other) — cit248_2,no-serious-consequence,open-ended survey (qualitative),Why not use PubPeer (other),Zenodo 10.5281/zenodo.20413424 — PubPeer perceptions (qualitative)
Q4noWontOtherR_3WdA8wGXOJhNPAB,The original authors have already adequately responded to the concern.,Why not use PubPeer (other) — cit408_2,pb-fixed-on-pubpeer,open-ended survey (qualitative),Why not use PubPeer (other),Zenodo 10.5281/zenodo.20413424 — PubPeer perceptions (qualitative)
Q4noWontOtherR_41s7918X4F35asV,The issue was resolved as the paper was withdrawn by the authors,Why not use PubPeer (other) — cit174_2,retraction/retracted; correction-done,open-ended survey (qualitative),Why not use PubPeer (other),Zenodo 10.5281/zenodo.20413424 — PubPeer perceptions (qualitative)
Q4noWontOtherR_46yuAO23wIITe5r,"I feel that PubPeer is a very dangerous platform, one which is frequently used for purposes it was originally intended for. Specifically, it is apparently used frequently for competing scientists/researchers to try and discredit their peers. I completely disagree with such practices and platforms which allow for such behavior.",Why not use PubPeer (other) — cit249_2,pubpeer-not-ok; pubpeer-misuse,open-ended survey (qualitative),Why not use PubPeer (other),Zenodo 10.5281/zenodo.20413424 — PubPeer perceptions (qualitative)
Q4noWontOtherR_4DN01snaGsNo8vJ,"Were these comments given by professionals? At present, some so-called anti-counterfeiting websites rely on artificial intelligence screening methods to question certain articles and then provide phone numbers and QR codes for profit. This itself goes against the purpose of science, and it is also very difficult for the authors of the articles to distinguish the authenticity.",Why not use PubPeer (other) — com409_2,expertise; pubpeer-misuse,open-ended survey (qualitative),Why not use PubPeer (other),Zenodo 10.5281/zenodo.20413424 — PubPeer perceptions (qualitative)
Q4noWontOtherR_55EaN4rerTonvqx,"I don't remember the issues, and don't want to take the time to look it up.",Why not use PubPeer (other) — cit254_2,time; old-paper,open-ended survey (qualitative),Why not use PubPeer (other),Zenodo 10.5281/zenodo.20413424 — PubPeer perceptions (qualitative)
Q4noWontOtherR_5EhysP5oW0yRzPs,The time needed to contact publishers to remove citations etc. is burdensome. The work I have published is sound and does not have errors. Duplications of images etc. in the commented articles on pubpeer do not affect my overall findings.,Why not use PubPeer (other) — cit355_2,time; no-serious-consequence; duplication,open-ended survey (qualitative),Why not use PubPeer (other),Zenodo 10.5281/zenodo.20413424 — PubPeer perceptions (qualitative)
Q4noWontOtherR_5Z3dC4UbTQ8Wm3f,I don't pay any attention to post review comments.  I never heard of PubPeer.,Why not use PubPeer (other) — cit410_2,pubpeer-not-ok,open-ended survey (qualitative),Why not use PubPeer (other),Zenodo 10.5281/zenodo.20413424 — PubPeer perceptions (qualitative)
Q4noWontOtherR_62KYUvwZwLkbWlp,"My publication was a review article, and the conclusions from the data, even if replicated, appear to be unchanged given the PubPeer information, so I do not think that there is a reason to change my publication in response.",Why not use PubPeer (other) — cit363_2,review-article; reproducibility; no-serious-consequence,open-ended survey (qualitative),Why not use PubPeer (other),Zenodo 10.5281/zenodo.20413424 — PubPeer perceptions (qualitative)
Q4noWontOtherR_6axxoMXhrfam7PQ,The comments do not result in any definitive altered conclusion and do not affect the data in the part of the manuscript that we were referencing,Why not use PubPeer (other) — cit203_2,no-serious-consequence,open-ended survey (qualitative),Why not use PubPeer (other),Zenodo 10.5281/zenodo.20413424 — PubPeer perceptions (qualitative)
Q4noWontOtherR_6DU0pGDZVF7xJkj,Whilst I agree it is a duplication I don't think it is affects the conclusions they are drawing,Why not use PubPeer (other) — cit270_2,no-serious-consequence; duplication,open-ended survey (qualitative),Why not use PubPeer (other),Zenodo 10.5281/zenodo.20413424 — PubPeer perceptions (qualitative)
Q4noWontOtherR_6NyTeIMbmDe87vb,"Addressing the Pubpeer comments requires the original data, which may or may not be available.",Why not use PubPeer (other) — cit370_2,data,open-ended survey (qualitative),Why not use PubPeer (other),Zenodo 10.5281/zenodo.20413424 — PubPeer perceptions (qualitative)
Q4noWontOtherR_6rBSNAX5cWfelHF,The journal and the authors addressed the comments to my satisfaction.,Why not use PubPeer (other) — cit88_2,correction-done; pb-fixed-on-pubpeer,open-ended survey (qualitative),Why not use PubPeer (other),Zenodo 10.5281/zenodo.20413424 — PubPeer perceptions (qualitative)
Q4noWontOtherR_7EygacxK4W5Z8u5,PP is a witchhunt disguised as a discussion site.,Why not use PubPeer (other) — cit411_2,pubpeer-misuse,open-ended survey (qualitative),Why not use PubPeer (other),Zenodo 10.5281/zenodo.20413424 — PubPeer perceptions (qualitative)
Q4noWontOtherR_7g52E06UmUJsxaN,I feel that our commentary was appropriately circumspect about the study already. There has also been several years since both publications.,Why not use PubPeer (other) — cit412_2,old-paper; citation-reasons,open-ended survey (qualitative),Why not use PubPeer (other),Zenodo 10.5281/zenodo.20413424 — PubPeer perceptions (qualitative)
Q4noWontOtherR_7sPjjg9AWNfBXmF,"This ""mistake"" does not affect the conclusion of our paper.",Why not use PubPeer (other) — cit413_2,no-serious-consequence,open-ended survey (qualitative),Why not use PubPeer (other),Zenodo 10.5281/zenodo.20413424 — PubPeer perceptions (qualitative)
Q4noWontOtherR_7ZqOJhhMjFGkGlP,They already retraced the paper,Why not use PubPeer (other) — cit92_2,retraction/retracted; correction-done,open-ended survey (qualitative),Why not use PubPeer (other),Zenodo 10.5281/zenodo.20413424 — PubPeer perceptions (qualitative)
Q4noWontOtherR_89hC2I1vtejt2OB,"The reason for which I cited this paper is not related to the issue raised on PubPeer.  I cited two other papers to illustrate the same point, so I am confident that it still stands as being correct.",Why not use PubPeer (other) — cit291_2,no-serious-consequence; citation-reasons,open-ended survey (qualitative),Why not use PubPeer (other),Zenodo 10.5281/zenodo.20413424 — PubPeer perceptions (qualitative)
Q4noWontOtherR_8Ck1En4qS6w3o2d,"If there is a genuine issue with the cited references, this does not necessarily diminish the scientific value of the publication, and authors are generally not held responsible for problems that may later arise with the references they used, as they relied on the reputation and credibility of the journals and publishers that originally published those references.",Why not use PubPeer (other) — com414_2,responsibility-to-journals; no-serious-consequence,open-ended survey (qualitative),Why not use PubPeer (other),Zenodo 10.5281/zenodo.20413424 — PubPeer perceptions (qualitative)
Q4noWontOtherR_8CQqHjpcl2naAy5,Most of the cited paper is still valid,Why not use PubPeer (other) — cit295_2,no-serious-consequence,open-ended survey (qualitative),Why not use PubPeer (other),Zenodo 10.5281/zenodo.20413424 — PubPeer perceptions (qualitative)
Q4noWontOtherR_8csTpSc4enlPKXT,"I just learned to know it, and the issue has been addressed earlier by another researcher",Why not use PubPeer (other) — cit296_2,correction-done; pb-fixed-on-pubpeer,open-ended survey (qualitative),Why not use PubPeer (other),Zenodo 10.5281/zenodo.20413424 — PubPeer perceptions (qualitative)
Q4noWontOtherR_8DZTc3vFdkdSi3I,"As explained above, this was a splice between figures - each showing a complete experiment -  and not a manipulation. Furthermore the data were published 21 years ago, when standards of how figures are assembled were different.",Why not use PubPeer (other) — com127_2,old-paper; not-fraud,open-ended survey (qualitative),Why not use PubPeer (other),Zenodo 10.5281/zenodo.20413424 — PubPeer perceptions (qualitative)
Q4noWontOtherR_8fjanldK8yst2RN,Too much time has passed since we published our paper. No one would care about this comment,Why not use PubPeer (other) — cit415_2,old-paper,open-ended survey (qualitative),Why not use PubPeer (other),Zenodo 10.5281/zenodo.20413424 — PubPeer perceptions (qualitative)
Q4noWontOtherR_8gEmYkfWYrRw42l,As explained in my previous reply - the objection seems to be groundless in this case.,Why not use PubPeer (other) — cit379_2,irrelevant-comment,open-ended survey (qualitative),Why not use PubPeer (other),Zenodo 10.5281/zenodo.20413424 — PubPeer perceptions (qualitative)
Q4noWontOtherR_8gTSsaPiHfCTxPw,If the science is correct it will be repeated and form part of the main body of literature.  If the data are wrong it will wont be repeated or cited.  Science is self-correcting in this way and Pubpeer is irrelevant,Why not use PubPeer (other) — cit416_2,self-correction-of-science; reproducibility; pubpeer-not-ok,open-ended survey (qualitative),Why not use PubPeer (other),Zenodo 10.5281/zenodo.20413424 — PubPeer perceptions (qualitative)
Q4noWontOtherR_8kSriFAkguemp5O,"Our citation was before the PubPeer comment and the paper is retracted anyway. Hence, there is no need to further comment on this paper",Why not use PubPeer (other) — cit305_2,retraction/retracted; correction-done,open-ended survey (qualitative),Why not use PubPeer (other),Zenodo 10.5281/zenodo.20413424 — PubPeer perceptions (qualitative)
Q4noWontOtherR_8lVZErbSidileVP,I think the conclusions from the PubPeer discussion is clear and there is no need to add anything.,Why not use PubPeer (other) — cit309_2,pb-fixed-on-pubpeer,open-ended survey (qualitative),Why not use PubPeer (other),Zenodo 10.5281/zenodo.20413424 — PubPeer perceptions (qualitative)
Q4noWontOtherR_8M97iLD7AyP3VGF,"As specified previously, the errors were corrected by authors.",Why not use PubPeer (other) — cit13_2,correction-done,open-ended survey (qualitative),Why not use PubPeer (other),Zenodo 10.5281/zenodo.20413424 — PubPeer perceptions (qualitative)
Q4noWontOtherR_8NER9An2FQCEBf0,It is useless,Why not use PubPeer (other) — cit131_2,other,open-ended survey (qualitative),Why not use PubPeer (other),Zenodo 10.5281/zenodo.20413424 — PubPeer perceptions (qualitative)
Q4noWontOtherR_8NPBgETkJFjqgmE,Disseration in English is contested,Why not use PubPeer (other) — cit381_2,other,open-ended survey (qualitative),Why not use PubPeer (other),Zenodo 10.5281/zenodo.20413424 — PubPeer perceptions (qualitative)
