feedback_id,feedback,title,author_codes,channel,product_area,source_dataset
Q3explainR_11bsrINu6HXHu5G,"the reference on the paper is associated with a method (well established) and not with the results reported on the paper reported on PubPeer, therefore it would appear that the issue mentioned on PubPeer does not affect the publication. Just in case, I am not sure.",Explain PubPeer concern / citation context — cit18_1,misunderstood-question; no-serious-consequence; citation-reasons; uncertain,open-ended survey (qualitative),Explain PubPeer concern / citation context,Zenodo 10.5281/zenodo.20413424 — PubPeer perceptions (qualitative)
Q3explainR_1bNbuypkwY4wRqG,"I was not aware that the paper I cited in my publication had been commented on in PubPeer. I see that the authors replied to the PubPeer concerns and acknowledged their error, then updated their paper, and also published an Erratum. Therefore, the issue was corrected by the time I cited this work in my own publications. I do not think had an impact on the conclusions of my own publication. However, I would like to thank PubPeer for informing me about this concern. From now on, I will check pubpeer before citing any publications in case there are concerns which would affect the conclusions of my own publications.",Explain PubPeer concern / citation context — cit161_1,correction-done; no-serious-consequence; happy-to-know; pubpeer-ok; action-other; error-not-fraud,open-ended survey (qualitative),Explain PubPeer concern / citation context,Zenodo 10.5281/zenodo.20413424 — PubPeer perceptions (qualitative)
Q3explainR_1c7NIlApaGD6acj,"evidence of band duplication resulted in manuscript withdrawl.  However, while this is one small piece of a larger body of evidence supporting the conclusions of the paper and impacts my opinion of the work little",Explain PubPeer concern / citation context — cit162_1,retraction/retracted; misunderstood-question; no-serious-consequence; duplication,open-ended survey (qualitative),Explain PubPeer concern / citation context,Zenodo 10.5281/zenodo.20413424 — PubPeer perceptions (qualitative)
Q3explainR_1EZliDCGXrZ4E7A,"My article was a review in which we stated ""the protein in MSA appears to have a different conformation and solubility profile"" when referencing the paper in person.",Explain PubPeer concern / citation context — cit39_1,misunderstood-question; review-article,open-ended survey (qualitative),Explain PubPeer concern / citation context,Zenodo 10.5281/zenodo.20413424 — PubPeer perceptions (qualitative)
Q3explainR_1I0jxVYmHaDzwOa,It appears to be a minor error that the author(s) have subsequently addressed on PubPeer.,Explain PubPeer concern / citation context — cit163_1,pb-fixed-on-pubpeer; error,open-ended survey (qualitative),Explain PubPeer concern / citation context,Zenodo 10.5281/zenodo.20413424 — PubPeer perceptions (qualitative)
Q3explainR_1PhaSeXq8rmoewB,"Thank you for pointing out this information regarding our Review article. As you mentioned in your email, we published this review article in 2016, i.e., before there was a comment in 2019 on one of the references (published by another group) in our article. Most importantly, as we have no way to foresee the future, I do not know how to prevent such issues and thus have no further comments. Finally, to be fair to the reviewers, I would like to mention that they also cannot foresee the future and therefore cannot be held responsible for such issues.",Explain PubPeer concern / citation context — cit164_1,review-article; time,open-ended survey (qualitative),Explain PubPeer concern / citation context,Zenodo 10.5281/zenodo.20413424 — PubPeer perceptions (qualitative)
Q3explainR_1Po2F6nMkOKWl4j,"It looks as a voluntary act, not an error",Explain PubPeer concern / citation context — cit57_1,fraud-not-error; intent,open-ended survey (qualitative),Explain PubPeer concern / citation context,Zenodo 10.5281/zenodo.20413424 — PubPeer perceptions (qualitative)
Q3explainR_2hzLNEW4CeDA1lC,"I think the evidence suggests that there are serious concerns with some of the data in that paper, which I believe should be investigated by The Plant Cell. Given this, I would have refrained from citing the paper in my review until the journal issues a final decision. A pity that I didn't know this when I co-author this review.",Explain PubPeer concern / citation context — cit165_1,responsibility-to-journals; regret-citation; review-article; misunderstood-question,open-ended survey (qualitative),Explain PubPeer concern / citation context,Zenodo 10.5281/zenodo.20413424 — PubPeer perceptions (qualitative)
EndR_45t3f6kEsww2yGw,"I appreciate the heads-up on the retracted work. Our citation of this work in the discussion of our paper included additional works, which we believe to be sound, in support of the point we were making. Therefore, disregarding the retracted work does not alter our thoughts on the point discussed in our paper.",Final open comment — cit166_5,retraction/retracted; citation-reasons; no-serious-consequence,open-ended survey (qualitative),Final open comment,Zenodo 10.5281/zenodo.20413424 — PubPeer perceptions (qualitative)
Q3explainR_8qvXNrx8KEyBHz5,"deliberate image splicing, does not need to be fraudulent though",Explain PubPeer concern / citation context — cit167_1,not-fraud; uncertain,open-ended survey (qualitative),Explain PubPeer concern / citation context,Zenodo 10.5281/zenodo.20413424 — PubPeer perceptions (qualitative)
Q3explainR_2QyGNPBC2eCn5E7,the focus of this part of my research is specifically about what I call 'alarming studies' that cause controversy in science and beyond. I also refer to its retraction and republication later in another journal.,Explain PubPeer concern / citation context — cit168_1,misunderstood-question; retraction/retracted; citation-reasons,open-ended survey (qualitative),Explain PubPeer concern / citation context,Zenodo 10.5281/zenodo.20413424 — PubPeer perceptions (qualitative)
EndR_7rwzpUry3dc6g5C,"As mentioned previously, Although very regrettable, the errors reported by Pubpeer did not affect the conclusion drawn from the corresponding figures, as they concerned images representing experiments that had been repeated several times. Although it was extremely painful to discover these errors immediately after the publication of our manuscript, I am grateful to Pubpeer for reporting them, as I could quickly react and ask for an erratum. It would be helpful if PubPeer could comment on the actions taken by the authors and include a label indicating whether or not they are convinced.",Final open comment — com169_5,no-serious-consequence; happy-to-know; other; correction-done; to-be-discussed-group,open-ended survey (qualitative),Final open comment,Zenodo 10.5281/zenodo.20413424 — PubPeer perceptions (qualitative)
Q3explainR_3mgzYZNFCXW9E3n,"There is clearly data/image problem, but my article is a review that does not directly pertain to this image.",Explain PubPeer concern / citation context — cit73_1,review-article; no-serious-consequence,open-ended survey (qualitative),Explain PubPeer concern / citation context,Zenodo 10.5281/zenodo.20413424 — PubPeer perceptions (qualitative)
Q3explainR_2TyOefjgKZAGoCG,"Authors' conclusions are usually based on numerous observations and series of experiments. While this may easily lead to mistakes, not all performed experiments can be documented in a paper.",Explain PubPeer concern / citation context — cit170_1,data,open-ended survey (qualitative),Explain PubPeer concern / citation context,Zenodo 10.5281/zenodo.20413424 — PubPeer perceptions (qualitative)
Q3explainR_3PHbKAWZFMe0ZZA,"It appears to be data manipulation, but I cannot be sure",Explain PubPeer concern / citation context — cit171_1,fraud-not-error; uncertain,open-ended survey (qualitative),Explain PubPeer concern / citation context,Zenodo 10.5281/zenodo.20413424 — PubPeer perceptions (qualitative)
Q4noWontOtherR_7EqmOVFXGvEKPLP,The pub peer comment is that a paper has been retracted that was cited in a review we wrote.,Why not use PubPeer (other) — cit122_2,retraction/retracted; review-article,open-ended survey (qualitative),Why not use PubPeer (other),Zenodo 10.5281/zenodo.20413424 — PubPeer perceptions (qualitative)
EndR_3CrsOoC4QIw0Szn,"The idea of citing that paper in reference 45, only for the synthesis of silica nanoparticles, which were developed with a wormhole pore architecture.",Final open comment — cit172_5,citation-reasons; no-serious-consequence,open-ended survey (qualitative),Final open comment,Zenodo 10.5281/zenodo.20413424 — PubPeer perceptions (qualitative)
EndR_8o1FJGXhWLVWleU,I greatly appreciate the comments on PubPeer but I would also appreciate concerns/criticisms associated with comments found in PPRR with non anonymous experts in the same field,Final open comment — cit173_5,pubpeer-ok-but; anonymity,open-ended survey (qualitative),Final open comment,Zenodo 10.5281/zenodo.20413424 — PubPeer perceptions (qualitative)
Q3explainR_41s7918X4F35asV,The paper was withrdawn by the Authors due to some image errors. That's not an error,Explain PubPeer concern / citation context — cit174_1,not-error; retraction/retracted,open-ended survey (qualitative),Explain PubPeer concern / citation context,Zenodo 10.5281/zenodo.20413424 — PubPeer perceptions (qualitative)
EndR_5Hs8ywwjG6AwUWB,This appears to have been a useful function of Pub peer (assuming the Pub peer publication came prior to the issued correction). I have encountered Pub peer comments that are sometimes not as useful (referring to a problematic figure in a paper when that figure did not even exist in the original figure).,Final open comment — cit175_5,pubpeer-ok-but; relevant-comment; irrelevant-comment,open-ended survey (qualitative),Final open comment,Zenodo 10.5281/zenodo.20413424 — PubPeer perceptions (qualitative)
Q3explainR_61gL8kOaqknRzXy,I do not know if it is an error or malicious falsification,Explain PubPeer concern / citation context — cit176_1,intent; error-not-fraud; fraud-not-error; uncertain,open-ended survey (qualitative),Explain PubPeer concern / citation context,Zenodo 10.5281/zenodo.20413424 — PubPeer perceptions (qualitative)
Q3explainR_4GxJSBrE5pnXSMA,"I can not be certain and say it was done deliberately or not. However, the concerns raised by the PubPeer reviewer are valid and supported with evidence raising a red flag to the papers being reviewed. This is a good platform that ensures that slight mistakes or errors that were overlooked by journal reviewers are addressed so that new upcoming researchers do not follow the wrong lead as it defeats the purpose of research. Same as following a methodology from a particular paper but struggling to get the results they claimed even though you followed the exact procedure. These should be questioned.",Explain PubPeer concern / citation context — cit177_1,intent; uncertain; pubpeer-ok; reproducibility,open-ended survey (qualitative),Explain PubPeer concern / citation context,Zenodo 10.5281/zenodo.20413424 — PubPeer perceptions (qualitative)
Q3explainR_6Ey5HDpr5YPBNNV,I am not specialist on geophysics issues and so I rather not decide whether there is an error or not.,Explain PubPeer concern / citation context — cit84_1,expertise; uncertain,open-ended survey (qualitative),Explain PubPeer concern / citation context,Zenodo 10.5281/zenodo.20413424 — PubPeer perceptions (qualitative)
Q3explainR_6GlEaNqta72Rsae,"Our paper is a review article.  We cited other scientists' and our own research to provide an overview of the topic.  I do not think this one citation would make or break the conclusions of the paper.  However, it would be helpful to know if a paper has been retracted prior to publishing a review article.  I will speak with the scientists in my lab to make them understand how important it is to download all publications cited for each of our manuscripts.  (BTW -- I thought this was done for this paper but it seems that not all references were downloaded to the manuscript folder.)",Explain PubPeer concern / citation context — cit178_1,review-article; retraction/retracted; action-other; misunderstood-question; no-serious-consequence,open-ended survey (qualitative),Explain PubPeer concern / citation context,Zenodo 10.5281/zenodo.20413424 — PubPeer perceptions (qualitative)
Q3explainR_6rNhBXg8xSw6NDb,it was a review article and it was not on PubPeer when we cited it,Explain PubPeer concern / citation context — cit179_1,misunderstood-question; review-article,open-ended survey (qualitative),Explain PubPeer concern / citation context,Zenodo 10.5281/zenodo.20413424 — PubPeer perceptions (qualitative)
EndR_8QPZ05GQeLFJial,"I appreciate the work that PubPeer is doing. Regarding the current inquiry, it appears that I cited, as an example, certain aspects of a paper that was published and later retracted. This has only a minimal impact on my work, since it is a review article that addresses a broad range of points.",Final open comment — cit180_5,pubpeer-ok; retraction/retracted; no-serious-consequence; review-article,open-ended survey (qualitative),Final open comment,Zenodo 10.5281/zenodo.20413424 — PubPeer perceptions (qualitative)
EndR_8CIjffyCMT2bjOl,It is very important to have an organization like PubPeer to openly point out errors or mistakes. It would be great if this control mechanism could also be applied to big data like single cell analysis.,Final open comment — cit156_5,pubpeer-ok; data,open-ended survey (qualitative),Final open comment,Zenodo 10.5281/zenodo.20413424 — PubPeer perceptions (qualitative)
Q3explainR_7qQzkk7j1ZLa8jB,"I would probably call it something else. Error seems to remove significance, like something unintentional, but it does not seem unintentional since the same problem happens more than once on the paper.",Explain PubPeer concern / citation context — cit181_1,accumulation-of-issues; fraud-not-error; intent,open-ended survey (qualitative),Explain PubPeer concern / citation context,Zenodo 10.5281/zenodo.20413424 — PubPeer perceptions (qualitative)
Q3explainR_2qVaK3rvCNzWVOt,I reported what was obtained experimentally,Explain PubPeer concern / citation context — com182_1,other,open-ended survey (qualitative),Explain PubPeer concern / citation context,Zenodo 10.5281/zenodo.20413424 — PubPeer perceptions (qualitative)
Q3explainR_4OJO6IC66MVe07Y,It was a duplication of a single FACS profile in a paper that had many dotplots. The authors corrected the specific issue. The paper conclusions remained the same.,Explain PubPeer concern / citation context — cit183_1,no-serious-consequence; correction-done; duplication,open-ended survey (qualitative),Explain PubPeer concern / citation context,Zenodo 10.5281/zenodo.20413424 — PubPeer perceptions (qualitative)
EndR_82p3G02oqstotJD,There are more relevant things to do in live.,Final open comment — cit184_5,other; to-be-discussed-group,open-ended survey (qualitative),Final open comment,Zenodo 10.5281/zenodo.20413424 — PubPeer perceptions (qualitative)
Q3explainR_5AWK6azlzkpemhQ,"It needs to be intentional for a copy and paste action.  The original was probably a bit smeared and not publication quality so they used the control band.  That would be improper, but they should have shown the original in the supplement.",Explain PubPeer concern / citation context — cit185_1,intent; to-be-discussed-group,open-ended survey (qualitative),Explain PubPeer concern / citation context,Zenodo 10.5281/zenodo.20413424 — PubPeer perceptions (qualitative)
Q3explainR_8EGqKkYNjvh4SbI,"The paper was cited because we used a reagent described in it. That reagent is excellent, in our hands and other colleagues' hands too. It is a widely used reagent in the field. Hence, in this specific case, the retraction did not impact on the concepts or results of our paper citing it.",Explain PubPeer concern / citation context — cit186_1,misunderstood-question; retraction/retracted; citation-reasons; no-serious-consequence; reproducibility,open-ended survey (qualitative),Explain PubPeer concern / citation context,Zenodo 10.5281/zenodo.20413424 — PubPeer perceptions (qualitative)
Q3explainR_2Rz592j3xGh7NuN,The authors should have clearly marked in the figure that some redundant lanes were intentionally removed from the blot,Explain PubPeer concern / citation context — cit187_1,intent; other,open-ended survey (qualitative),Explain PubPeer concern / citation context,Zenodo 10.5281/zenodo.20413424 — PubPeer perceptions (qualitative)
Q4noWontOtherR_1DdolAzrmDpMA20,"The comment is not relevant to why we cited the paper. Also, the comment is aggressive and I do not want to engage with vitriol.",Why not use PubPeer (other) — cit188_2,citation-reasons; no-serious-consequence; tone; irrelevant-comment,open-ended survey (qualitative),Why not use PubPeer (other),Zenodo 10.5281/zenodo.20413424 — PubPeer perceptions (qualitative)
Q3explainR_9FuZxXCCjc4CjZL,It is one of the citation in our review paper. The sentence I cited them contains other 3 citations. I have doubt of whether the Journal will make correction for just one citation.,Explain PubPeer concern / citation context — cit189_1,review-article; misunderstood-question,open-ended survey (qualitative),Explain PubPeer concern / citation context,Zenodo 10.5281/zenodo.20413424 — PubPeer perceptions (qualitative)
Q4noWontOtherR_2KCtRC5pgg1vVAF,"The article in question has not been retracted, and because our interpretation is supported by multiple independent studies, I currently see no compelling reason to modify our published work.

Nonetheless, I recognize the value of post-publication peer review platforms such as PubPeer and support open scientific discussion and critical evaluation.",Why not use PubPeer (other) — cit42_2,pubpeer-ok; responsibility-to-journals; no-serious-consequence,open-ended survey (qualitative),Why not use PubPeer (other),Zenodo 10.5281/zenodo.20413424 — PubPeer perceptions (qualitative)
Q3explainR_8JLb9OC6YVWOOMV,"The authors when they prepare the figures on their results must have full knowledge of what they are reporting, so I don´t believe it is an error to provide for publication images that are clearly incorrect.",Explain PubPeer concern / citation context — cit190_1,not-error; intent,open-ended survey (qualitative),Explain PubPeer concern / citation context,Zenodo 10.5281/zenodo.20413424 — PubPeer perceptions (qualitative)
EndR_2F86uHfNp7fS6KR,"Even if the criticisms are partially valid—and the authors themselves have acknowledged limitations in their own remarks—I contend that a one-size-fits-all approach is inimical to scientific progress. In my view, there is a substantive difference between results that have been independently corroborated and those that have been definitively refuted. Retracting a paper whose findings have been empirically validated constitutes a disservice to the scientific enterprise.",Final open comment — cit191_5,retraction/retracted; to-be-discussed-group,open-ended survey (qualitative),Final open comment,Zenodo 10.5281/zenodo.20413424 — PubPeer perceptions (qualitative)
Q3explainR_9hXYppG5AZzbm42,The caption indicates that the two duplicated images should belong to tissues derived from different mice.,Explain PubPeer concern / citation context — cit192_1,duplication; other,open-ended survey (qualitative),Explain PubPeer concern / citation context,Zenodo 10.5281/zenodo.20413424 — PubPeer perceptions (qualitative)
Q4noWontOtherR_63KN3ow1loqFH7r,"As a coauthor in this paper, my contribution is not relevant to the specific issue PubPeer has discovered.",Why not use PubPeer (other) — cit83_2,no-serious-consequence,open-ended survey (qualitative),Why not use PubPeer (other),Zenodo 10.5281/zenodo.20413424 — PubPeer perceptions (qualitative)
Q4noWontOtherR_8C1K0fKa2FofJYk,"Unless there is an expression of concern from the editors, I don't feel entitled to e.g. ask for a correction ot remove the reference.",Why not use PubPeer (other) — cit193_2,responsibility-to-journals,open-ended survey (qualitative),Why not use PubPeer (other),Zenodo 10.5281/zenodo.20413424 — PubPeer perceptions (qualitative)
Q3explainR_2FLfCoYBFGThe81,"I have many concerns regarding PubPeer as it is especially when it is used by the Journals to investigate on the works of authors that have been published more thatn 10 years ago. I do not question that it may be useful for starting a scientific discussion on a specific paper or part of it, I discuss the fact that there is no use to ask for original blots for papers published 10 or 15 years ago when sending original uncropped blots was not requested. How can the authors find those original blots if they were on films that are lost, ruined or else? Even stored scanned films cannot be found because computers get old and, for example, are discarded during laboratory renovations. I think it would be more useful to start a discussion with the authors involving others scientists and editors about their results and if these results have been confirmed by other groups or not. If this is the case then what is the point to ask for an actin because it looks similar to another actin of another blot? or question why the authors have used the same control in two different figurees?
It is correct that the journal are now asking the authors to submit original images of their work. What is not correct is to transform this to an obsession towards old published papers where it was not mandatory and when the journals had other rules. I am afraid that this is transforming into a witch hunt. I would find more useful if the journal check how many times the paper has been cited, how many of tese citations are reviewes and how many are original papers and if they reached the same conclusions of the paper under scrutiny or if they confirmed the results or not.",Explain PubPeer concern / citation context — cit194_1,pubpeer-ok-but; old-paper; responsibility-to-journals; pubpeer-misuse; data,open-ended survey (qualitative),Explain PubPeer concern / citation context,Zenodo 10.5281/zenodo.20413424 — PubPeer perceptions (qualitative)
Q3explainR_5SDEOXDAT3sJdVL,I only used the reference in our paper as a reference for an antibody that I used in our manuscript.   I do no have the expertise to assess the the error detailed in the PubPeer review.,Explain PubPeer concern / citation context — cit195_1,expertise; citation-reasons; uncertain,open-ended survey (qualitative),Explain PubPeer concern / citation context,Zenodo 10.5281/zenodo.20413424 — PubPeer perceptions (qualitative)
EndR_5fcyjuYyLIJJuyG,"When the science community values the number of publications over the quality of publications the pressure to put out as many papers as possible becomes the overriding driver. In this case the authors turned out to be right, but it appears as though they were just in too much of a hurry to redo the assays.",Final open comment — cit19_5,time; research-evaluation,open-ended survey (qualitative),Final open comment,Zenodo 10.5281/zenodo.20413424 — PubPeer perceptions (qualitative)
Q3explainR_8CEhUdHHGhCdwc4,"The figures commented in PubPeer were probably edited; however, if this was the case, the intention was to make them more acceptable for publication, not to conceal or manipulate the results",Explain PubPeer concern / citation context — cit196_1,error-not-fraud,open-ended survey (qualitative),Explain PubPeer concern / citation context,Zenodo 10.5281/zenodo.20413424 — PubPeer perceptions (qualitative)
EndR_2LZkKv4aib96THj,PubPeer is really useful in some cases. However in this case it seems that the presumably automated image analysis used happened to find only a human error that did not affect the conclusions of the paper criticised.,Final open comment — cit197_5,pubpeer-ok-but; error; no-serious-consequence,open-ended survey (qualitative),Final open comment,Zenodo 10.5281/zenodo.20413424 — PubPeer perceptions (qualitative)
EndR_82o7Cd6pFVaiJ7y,"As stated on the first page, this is a case of trolling by a fraudulent scientist.",Final open comment — com198_5,pubpeer-misuse; fraud,open-ended survey (qualitative),Final open comment,Zenodo 10.5281/zenodo.20413424 — PubPeer perceptions (qualitative)
Q4noWontOtherR_6ikTnM5tZxpNkPY,"The specific claim that I was referencing by pointing to this and other papers is well supported by evidence and is part of the scientific consensus. The conclusions of my paper are not affected by this error because I was referencing it as background info on the protein that was the focus of my study. My study investigated a different aspect of this protein. Thus, I will not do anything in relation to my paper. But in general I am quite unhappy to see an instance of ""repurposing"", intentional or not, of a Western blot in a high profile paper.",Why not use PubPeer (other) — cit199_2,citation-reasons; reproducibility; no-serious-consequence; intent,open-ended survey (qualitative),Why not use PubPeer (other),Zenodo 10.5281/zenodo.20413424 — PubPeer perceptions (qualitative)
EndR_6B8PIrno5emGcbD,"Pub Peer is good but as I mentioned before, it encourages people to make aggressive and often erroneous coments behind the anonymity, instead of a polite e-mail first to the corresponding author or journal. Allows for an abusive of power behind the anonymity - kind of like the US ICE agents behind the mask as a analogy.",Final open comment — com200_5,pubpeer-ok-but; anonymity; contacting-authors; tone; to-be-discussed-group,open-ended survey (qualitative),Final open comment,Zenodo 10.5281/zenodo.20413424 — PubPeer perceptions (qualitative)
