feedback_id,feedback,title,author_codes,channel,product_area,source_dataset
EndR_81Kw2FlJpZBklEt,"The PubPeer comments suggest flaws in a nearly 20-year-old paper from another group which was cited in discussion in a 15-year-old, relatively minor paper from our lab. Anyone looking over our work and seeing this citation would have access to PubPeer comments (and other fora where work is discussed/ reconsidered) in determining whether to make use of it.  I feel that it is beyond the scope of authorial duty to review citations *after* publication, regardless of",Final open comment — cit527_5,old-paper; incomplete-unclear,open-ended survey (qualitative),Final open comment,Zenodo 10.5281/zenodo.20413424 — PubPeer perceptions (qualitative)
EndR_82E19WTFVPcjY3u,"PubPeer is going a great service to the scientific community. As a suggestion, It would be great to create option in Pubbeer for those in the field to score 1) the reproducibility and 2) veracity of conclusions and 3) impact of studies.",Final open comment — cit289_5,pubpeer-ok; other,open-ended survey (qualitative),Final open comment,Zenodo 10.5281/zenodo.20413424 — PubPeer perceptions (qualitative)
EndR_89mJjKZMrHOXGlH,"I was at one time an advocate for Post-Publication Peer Review. Having seen the way it has been implemented however, I think the enterprise is bound to fail. All that I see is that the loudest voices dominate the discussion. Those who have the time to spend on this obsess over the comments on there. I have neither the time nor the patience to correct the record continuously. It is like trying to nail jelly to the wall.",Final open comment — com528_5,pubpeer-ok-but; time; pubpeer-misuse,open-ended survey (qualitative),Final open comment,Zenodo 10.5281/zenodo.20413424 — PubPeer perceptions (qualitative)
EndR_8CEhUdHHGhCdwc4,I stopped the discussion in PubPeer because I got the feeling that I had been convicted of scientific fraud from the beginning no matter what my explanations would be,Final open comment — cit196_5,tone; action-stop-pubpeer,open-ended survey (qualitative),Final open comment,Zenodo 10.5281/zenodo.20413424 — PubPeer perceptions (qualitative)
EndR_8ciOa4MSuzAKHkt,It was an honest mistake by the author in the processing of an image which we rectified. I sent the original annotated blot to demonstrate how it had happened to the editors who were happy with the explanation and how the error had occurred. I think there is an element of guilty until proven innocent on the website with some individuals and the fact is sometimes genuine errors are made. I think though there are repeat high profile offenders who seem to have continued their careers untarnished for many years,Final open comment — com293_5,error-not-fraud; correction-done,open-ended survey (qualitative),Final open comment,Zenodo 10.5281/zenodo.20413424 — PubPeer perceptions (qualitative)
EndR_8CQqHjpcl2naAy5,"PPPR is doing a great job. Well done! too many bad actors out there at the moment and even as a scientist, I am loosing faith in the publication process!!",Final open comment — cit295_5,pubpeer-ok; fraud,open-ended survey (qualitative),Final open comment,Zenodo 10.5281/zenodo.20413424 — PubPeer perceptions (qualitative)
EndR_8e2LeNjwSXZWLct,Pubpeer comments are useful but the language used is often inccorrect as sometimes the issues mentioned are genuine mistakes during compilation of an image rather than anything sinister as suggested to by most posts on Pubpeer. I think it should be used constructively to pint out mistakes as if they were mistakes rather than making inflammatory comments.,Final open comment — cit128_5,pubpeer-ok-but; tone; error-not-fraud,open-ended survey (qualitative),Final open comment,Zenodo 10.5281/zenodo.20413424 — PubPeer perceptions (qualitative)
EndR_8iFdygdLY4ho3tL,Anonymous accusations cannot be taken seriously.,Final open comment — cit301_5,anonymity,open-ended survey (qualitative),Final open comment,Zenodo 10.5281/zenodo.20413424 — PubPeer perceptions (qualitative)
EndR_8tsd70uDIrjN4mJ,All the retracted papers shall be highlighted and removed/blocked from any possible database,Final open comment — cit420_5,retraction/retracted,open-ended survey (qualitative),Final open comment,Zenodo 10.5281/zenodo.20413424 — PubPeer perceptions (qualitative)
EndR_8ZHrMVlrqTX4WIW,"The comments referred to here were from students and while I appreciate their critical approach it seems a bit like a disrespect for experienced in the area peer-reviewer to claim that they overlooked a possible manipulation of blots, in particular for a highly reputed journal such as Nature communications.",Final open comment — cit529_5,students; relevant-comment; to-be-discussed-group,open-ended survey (qualitative),Final open comment,Zenodo 10.5281/zenodo.20413424 — PubPeer perceptions (qualitative)
EndR_914NkGXRmut4TEz,Thank you for investigating this. There should be more effort to uncover and punish research fraud.,Final open comment — cit321_5,thanks; fraud,open-ended survey (qualitative),Final open comment,Zenodo 10.5281/zenodo.20413424 — PubPeer perceptions (qualitative)
EndR_91WYqktc1xtFvPj,"Honestly, I didn't even know PubPeer existed in 2018 when I wrote the paper.",Final open comment — cit422_5,other,open-ended survey (qualitative),Final open comment,Zenodo 10.5281/zenodo.20413424 — PubPeer perceptions (qualitative)
EndR_97D6QbzCPqfHEMV,"Pubpeer platform should not be open forum as many scientific data is much more explanable through experience and experiments not by visual graphs...
It must not allow anonymous person to comment anything which he can...",Final open comment — cit530_5,pubpeer-not-ok; anonymity,open-ended survey (qualitative),Final open comment,Zenodo 10.5281/zenodo.20413424 — PubPeer perceptions (qualitative)
EndR_9CCtgxMnGPeMGeU,"I want to suggest Elsevier not to loose the trust of many reputed authors by focussing on such bogus websites like pubpeer or websites like pubpeer. They might getting funding to do .

Authors trust Elsevier as a very reputed forum to showcase their hard earned research .",Final open comment — cit323_5,pubpeer-not-ok; to-be-discussed-group,open-ended survey (qualitative),Final open comment,Zenodo 10.5281/zenodo.20413424 — PubPeer perceptions (qualitative)
EndR_9dpc8GcX8werJWS,"I haven't had much experience with PubPeer, but this opportunity to take a deeper look at this case has made me very skeptical of it. I always assumed that people were picking up actual substantive errors or misconduct. The example I looked at was clearly not that. It just seemed completely nitpicking and anachronistic, complaining about processes that were acceptable when the paper was originally published, and did not in any way change the scientific conclusion. Worse, the main point of the paper had actually been replicated by multiple later studies, so the issue raised was self-evidently not an error or a falsehood. In this case at least, this whole exercise just felt like typically academic navelgazing at its most egregious.",Final open comment — cit324_5,irrelevant-comment; old-paper; no-serious-consequence; correction-done,open-ended survey (qualitative),Final open comment,Zenodo 10.5281/zenodo.20413424 — PubPeer perceptions (qualitative)
EndR_9fMFmlsOVLwSIhj,"This platform is disgusting, most of the comments are useless and seems just trying to harm the authors reputation",Final open comment — com531_5,pubpeer-not-ok; consequence-reputation; pubpeer-misuse,open-ended survey (qualitative),Final open comment,Zenodo 10.5281/zenodo.20413424 — PubPeer perceptions (qualitative)
Q4noButWillotherR_20C9Tn4dKHxN4Ld,I would try to do it better next time,"Not yet, but may use (other) — cit58_4",action-other,open-ended survey (qualitative),"Not yet, but may use (other)",Zenodo 10.5281/zenodo.20413424 — PubPeer perceptions (qualitative)
Q4noButWillotherR_2EsPQMSacRSjAqv,"For the paper cited in pubeer, I tried to interpret the figures from","Not yet, but may use (other) — cit532_4",none,open-ended survey (qualitative),"Not yet, but may use (other)",Zenodo 10.5281/zenodo.20413424 — PubPeer perceptions (qualitative)
Q4noButWillotherR_95zRYGrpV64hC9x,"I believe PubPeer plays a crucial role in maintaining scientific integrity. However, this manuscript was published 10 years ago. Naturally, I will approach their future studies with caution and have already informed my close colleagues about the issue","Not yet, but may use (other) — cit385_4",action-other; old-paper; pubpeer-ok-but,open-ended survey (qualitative),"Not yet, but may use (other)",Zenodo 10.5281/zenodo.20413424 — PubPeer perceptions (qualitative)
Q4noWontOtherR_12nyRbXt7Ws0VyX,"In this case, the comment was addressed with a correction and the error was minor.",Why not use PubPeer (other) — cit211_2,correction-done; no-serious-consequence,open-ended survey (qualitative),Why not use PubPeer (other),Zenodo 10.5281/zenodo.20413424 — PubPeer perceptions (qualitative)
Q4noWontOtherR_145FCyQiI9cydMJ,not sure what I would do?,Why not use PubPeer (other) — cit426_2,uncertain,open-ended survey (qualitative),Why not use PubPeer (other),Zenodo 10.5281/zenodo.20413424 — PubPeer perceptions (qualitative)
Q4noWontOtherR_1eVYOt7ykG7exYS,The error in the cited paper does not affect any conclusions in our work,Why not use PubPeer (other) — cit533_2,no-serious-consequence,open-ended survey (qualitative),Why not use PubPeer (other),Zenodo 10.5281/zenodo.20413424 — PubPeer perceptions (qualitative)
Q4noWontOtherR_1qmVHF37xa8s4CJ,"Since there is not a problem, there is nothing I need to do",Why not use PubPeer (other) — cit431_2,irrelevant-comment,open-ended survey (qualitative),Why not use PubPeer (other),Zenodo 10.5281/zenodo.20413424 — PubPeer perceptions (qualitative)
Q4noWontOtherR_2dLcaZdVeSb2zyV,"As it does not alter or affect the concept cited in our work, it is not my responsibility to judge or comment about another part of the cited article, unrelated to the concept we cited.",Why not use PubPeer (other) — cit224_2,no-serious-consequence,open-ended survey (qualitative),Why not use PubPeer (other),Zenodo 10.5281/zenodo.20413424 — PubPeer perceptions (qualitative)
Q4noWontOtherR_2FJWXomSqTXD3sC,"This is a matter for the journal to take care. They have accepted the paper and are responsible for it. It is all right for them to charge extortionate publication fees, expect reviewers to work for free, make authors undergo endless waiting times, etc.. and now on top of this they even pretend put the burden on other people to work (again, for free) in helping correct their mistakes!!!?. Not bloody like it, I think. Maybe it is about time they start thinking about earning their money like everyone else.",Why not use PubPeer (other) — cit107_2,responsibility-to-journals; to-be-discussed-group,open-ended survey (qualitative),Why not use PubPeer (other),Zenodo 10.5281/zenodo.20413424 — PubPeer perceptions (qualitative)
Q4noWontOtherR_2GPUmNs0oFkd5tn,"in this particular instance, the paper is not relevant to my research and other citations/ref prove the same point, so I wouldnt change; the problem with having people comment on any paper is that genuine mistakes get labelled as dodgy, leaving a black mark on the researcher..one of my own paper figures has been picked up with one band on a western blot which is part of one figure. there is no way to dig through raw western blot figures over 15 years ago. also, in my paper, (as with most publications) the conclusion is drawn based on multiple datasets/figures not merely one. and we cannot posisbly repeat those experiments- indeed many of us have left the lab, moved fields and research focus. before the pubpeer is allowed to publish anonymous comments it would be good to have some oversight/overseeing authority that can conclude if the data has ben manipulated to a large extent that it changes the conclusion or a minor fault that has no impact on the finding. currently there is no way to distinguish the two and isolated figures are pulled up ,and published, which is unfair. as researchers we strive to our best and very happy to be corrected, but some comment saying this is a minor error that does not affect conclusion, looks sloppy vs a major error that will affect conclusion will be better for the scientific community.",Why not use PubPeer (other) — cit60_2,no-serious-consequence; anonymity; differentiate-minor-major; old-paper; consequence-reputation,open-ended survey (qualitative),Why not use PubPeer (other),Zenodo 10.5281/zenodo.20413424 — PubPeer perceptions (qualitative)
Q4noWontOtherR_2mGn1UwPLOWAyLD,no impact on our own work,Why not use PubPeer (other) — cit534_2,no-serious-consequence,open-ended survey (qualitative),Why not use PubPeer (other),Zenodo 10.5281/zenodo.20413424 — PubPeer perceptions (qualitative)
Q4noWontOtherR_2rcu0AZDu6zXfLu,Issue has been solved. Pubpeer should remove comments if a correction has been provided,Why not use PubPeer (other) — cit239_2,correction-done; remove-comment,open-ended survey (qualitative),Why not use PubPeer (other),Zenodo 10.5281/zenodo.20413424 — PubPeer perceptions (qualitative)
Q4noWontOtherR_39taBkGNPon1jnl,"See my answer on the previous page. As I said, the comment was an attempt to find an error in our paper but it failed.",Why not use PubPeer (other) — cit535_2,irrelevant-comment,open-ended survey (qualitative),Why not use PubPeer (other),Zenodo 10.5281/zenodo.20413424 — PubPeer perceptions (qualitative)
Q4noWontOtherR_3FRqvP136w5dkte,The noted FACS duplication had no effect on any of the conclusions in that paper or in my own paper.,Why not use PubPeer (other) — cit245_2,no-serious-consequence; duplication,open-ended survey (qualitative),Why not use PubPeer (other),Zenodo 10.5281/zenodo.20413424 — PubPeer perceptions (qualitative)
Q4noWontOtherR_3JzzmEDgLKRtkov,"I was already aware of the comment, as were many people in the field. The issues involving possible image manipulations are concerning but the results of the study remain valid.",Why not use PubPeer (other) — cit246_2,aware-of-pb; no-serious-consequence; fraud,open-ended survey (qualitative),Why not use PubPeer (other),Zenodo 10.5281/zenodo.20413424 — PubPeer perceptions (qualitative)
Q4noWontOtherR_3Uvp4WIUb99i8Ap,I do not think that starting a conversation about this is worth the time and possibility of engaging with someone who will not be reasonable.  I am saving my energy in that regard for the serious political problems and the attack on science that are going on in my country right now.,Why not use PubPeer (other) — cit442_2,time; other,open-ended survey (qualitative),Why not use PubPeer (other),Zenodo 10.5281/zenodo.20413424 — PubPeer perceptions (qualitative)
Q4noWontOtherR_3uyBZrC5LNR3wK2,I do not know what I could do.,Why not use PubPeer (other) — cit113_2,uncertain,open-ended survey (qualitative),Why not use PubPeer (other),Zenodo 10.5281/zenodo.20413424 — PubPeer perceptions (qualitative)
Q4noWontOtherR_42gPJekRKNCuwhc,The PubPeer comment doesn't highlight an error. This survey seems to presume that PubPeer comments describe errors. This is incorrect.,Why not use PubPeer (other) — cit471_2,not-error,open-ended survey (qualitative),Why not use PubPeer (other),Zenodo 10.5281/zenodo.20413424 — PubPeer perceptions (qualitative)
Q4noWontOtherR_4CptdjbIYg8RLv5,Since the manipulation is not impacting the general conclusion of the paper I am not interested to think about it now.,Why not use PubPeer (other) — cit499_2,no-serious-consequence,open-ended survey (qualitative),Why not use PubPeer (other),Zenodo 10.5281/zenodo.20413424 — PubPeer perceptions (qualitative)
Q4noWontOtherR_4YRkDmnQGjlMANj,The comments reflect the differing opinions of several people who have looked at the WBs. Not all agree that there is any manipulation. I would prefer to give the authors the benefit of doubt and state that they made an honest mistake of changing the blot orientations.,Why not use PubPeer (other) — cit443_2,opinion; error-not-fraud,open-ended survey (qualitative),Why not use PubPeer (other),Zenodo 10.5281/zenodo.20413424 — PubPeer perceptions (qualitative)
Q4noWontOtherR_57KCICkj3WF1NYK,I do not know what I could do.,Why not use PubPeer (other) — cit256_2,uncertain,open-ended survey (qualitative),Why not use PubPeer (other),Zenodo 10.5281/zenodo.20413424 — PubPeer perceptions (qualitative)
Q4noWontOtherR_5Hs8ywwjG6AwUWB,The error was caught and a correction was already published by the authors. This appears to have been an error and not fraud so I feel the issue has already been addressed. This may have been in response to pumper but in any case the correction appears to have been made.,Why not use PubPeer (other) — cit175_2,correction-done; error-not-fraud,open-ended survey (qualitative),Why not use PubPeer (other),Zenodo 10.5281/zenodo.20413424 — PubPeer perceptions (qualitative)
Q4noWontOtherR_5hYyMjNFicGutSo,It was only one of several studies cited as general comments in the discussion in my paper.  Had no bearing on how my study was conducted or the conclusions made.,Why not use PubPeer (other) — cit115_2,citation-reasons; no-serious-consequence,open-ended survey (qualitative),Why not use PubPeer (other),Zenodo 10.5281/zenodo.20413424 — PubPeer perceptions (qualitative)
Q4noWontOtherR_5mn9qgxYYI5Cann,"The citation was toward a very general value of studying aging biomarkers, so the specific results of the paper do not have any impact on the validity of our paper.",Why not use PubPeer (other) — cit263_2,citation-reasons; no-serious-consequence,open-ended survey (qualitative),Why not use PubPeer (other),Zenodo 10.5281/zenodo.20413424 — PubPeer perceptions (qualitative)
Q4noWontOtherR_5NvLQfRvbnZkQmk,"The paper was cited in the intro with a list of multiple publications to raise a point about the different taxa reported in studies, so it doesn't affect the validity of our paper. I'm glad it was discovered and called out on pubpeer. It's good that this is reported.",Why not use PubPeer (other) — cit536_2,citation-reasons; no-serious-consequence; happy-to-know,open-ended survey (qualitative),Why not use PubPeer (other),Zenodo 10.5281/zenodo.20413424 — PubPeer perceptions (qualitative)
Q4noWontOtherR_6fiPiyWuSRRZhlT,"In this specific case, we cited this work as other to set up a context of the research (literature review) rather that referring to specific data and since it has not impact on our conclusions.",Why not use PubPeer (other) — cit119_2,citation-reasons; no-serious-consequence,open-ended survey (qualitative),Why not use PubPeer (other),Zenodo 10.5281/zenodo.20413424 — PubPeer perceptions (qualitative)
Q4noWontOtherR_6hcCanhrDljRj0i,"This has already been dealt with by the journal in which the paper mentioned in PubPeer was published. The fabricated image did not affect the conclusions of that paper, however.",Why not use PubPeer (other) — cit271_2,correction-done; no-serious-consequence,open-ended survey (qualitative),Why not use PubPeer (other),Zenodo 10.5281/zenodo.20413424 — PubPeer perceptions (qualitative)
Q4noWontOtherR_6NR6R5CMCe3rDor,Authors addressed them already,Why not use PubPeer (other) — cit537_2,correction-done,open-ended survey (qualitative),Why not use PubPeer (other),Zenodo 10.5281/zenodo.20413424 — PubPeer perceptions (qualitative)
Q4noWontOtherR_6sRU65i5WbOzfkB,It was ~25 years ago and the major conclusions of that paper have been validated many times over.,Why not use PubPeer (other) — cit508_2,old-paper; no-serious-consequence,open-ended survey (qualitative),Why not use PubPeer (other),Zenodo 10.5281/zenodo.20413424 — PubPeer perceptions (qualitative)
Q4noWontOtherR_6ToEG2AHGAcV9ZL,Removing the identified paper from the ref list of our review would require a lot of justification to the journal that i do not have the time to entertain.,Why not use PubPeer (other) — cit451_2,time; review-article,open-ended survey (qualitative),Why not use PubPeer (other),Zenodo 10.5281/zenodo.20413424 — PubPeer perceptions (qualitative)
Q4noWontOtherR_7343ndIHR6biqD0,Corresponding author have responded and corrected the mistake and it appear in the journal erratum.,Why not use PubPeer (other) — cit279_2,correction-done,open-ended survey (qualitative),Why not use PubPeer (other),Zenodo 10.5281/zenodo.20413424 — PubPeer perceptions (qualitative)
Q4noWontOtherR_7JauqMgl5FJm0jY,"Does not affect the conclusions of our own published work, and the journal has in retracted the publication with the error/misrepresentation",Why not use PubPeer (other) — cit281_2,no-serious-consequence; retraction/retracted,open-ended survey (qualitative),Why not use PubPeer (other),Zenodo 10.5281/zenodo.20413424 — PubPeer perceptions (qualitative)
Q4noWontOtherR_7msDK6k7UiwnUxV,"Our work is a review with several hundred references. We have multiple references supporting the positions we advocate in our review. One Pubpeer comment, although correct, doesn't alter our position meaningfully.",Why not use PubPeer (other) — cit538_2,review-article; no-serious-consequence,open-ended survey (qualitative),Why not use PubPeer (other),Zenodo 10.5281/zenodo.20413424 — PubPeer perceptions (qualitative)
Q4noWontOtherR_7qQzkk7j1ZLa8jB,"I believe the problem is already detected, pointed out, and commented on. So, it is up to the journal to sort it.",Why not use PubPeer (other) — cit181_2,responsibility-to-journals,open-ended survey (qualitative),Why not use PubPeer (other),Zenodo 10.5281/zenodo.20413424 — PubPeer perceptions (qualitative)
Q4noWontOtherR_805dYQT5Cvwlu2B,"We cite the paper in terms of NRP1's general activity in cell adhesion, not the mechanism. That part at the least stands in the paper cited.",Why not use PubPeer (other) — cit459_2,citation-reasons; no-serious-consequence,open-ended survey (qualitative),Why not use PubPeer (other),Zenodo 10.5281/zenodo.20413424 — PubPeer perceptions (qualitative)
Q4noWontOtherR_80UymRefo9LkndP,I think the authors have provided a clear and adequate response to the comments.,Why not use PubPeer (other) — cit454_2,pb-fixed-on-pubpeer,open-ended survey (qualitative),Why not use PubPeer (other),Zenodo 10.5281/zenodo.20413424 — PubPeer perceptions (qualitative)
Q4noWontOtherR_84d60v7eqYtU1SA,Too long ago to still be relevant today.,Why not use PubPeer (other) — cit539_2,old-paper,open-ended survey (qualitative),Why not use PubPeer (other),Zenodo 10.5281/zenodo.20413424 — PubPeer perceptions (qualitative)
Q4noWontOtherR_8bWxgv1NminUW2S,Does not impact our publication,Why not use PubPeer (other) — cit292_2,no-serious-consequence,open-ended survey (qualitative),Why not use PubPeer (other),Zenodo 10.5281/zenodo.20413424 — PubPeer perceptions (qualitative)
Q4noWontOtherR_8cmkkCmSgAgK8CJ,the issue was resolved satisfactorily.,Why not use PubPeer (other) — cit294_2,correction-done,open-ended survey (qualitative),Why not use PubPeer (other),Zenodo 10.5281/zenodo.20413424 — PubPeer perceptions (qualitative)
Q4noWontOtherR_8dP5xRSiCrNu7G9,There is no issue,Why not use PubPeer (other) — cit298_2,irrelevant-comment,open-ended survey (qualitative),Why not use PubPeer (other),Zenodo 10.5281/zenodo.20413424 — PubPeer perceptions (qualitative)
Q4noWontOtherR_8HtAaB7BPagge43,Trivial error in figure preparation not affecting scientific conclusions,Why not use PubPeer (other) — cit12_2,no-serious-consequence,open-ended survey (qualitative),Why not use PubPeer (other),Zenodo 10.5281/zenodo.20413424 — PubPeer perceptions (qualitative)
Q4noWontOtherR_8JLb9OC6YVWOOMV,The PubPeer comment does not affect or alter the conclusions in our study. The paper is cited only in the introduction.,Why not use PubPeer (other) — cit190_2,no-serious-consequence; citation-reasons,open-ended survey (qualitative),Why not use PubPeer (other),Zenodo 10.5281/zenodo.20413424 — PubPeer perceptions (qualitative)
Q4noWontOtherR_8jTLfEiXRtUyXkp,The issue has been resolved.,Why not use PubPeer (other) — cit468_2,correction-done,open-ended survey (qualitative),Why not use PubPeer (other),Zenodo 10.5281/zenodo.20413424 — PubPeer perceptions (qualitative)
Q4noWontOtherR_8Lnj8SFDs5dwTsS,As I wrote earlier I was totally unaware that PubPeer existed and have absolutely no opinion on any comment by PubPeer.,Why not use PubPeer (other) — cit36_2,other,open-ended survey (qualitative),Why not use PubPeer (other),Zenodo 10.5281/zenodo.20413424 — PubPeer perceptions (qualitative)
Q4noWontOtherR_8qvXNrx8KEyBHz5,"It does not affect the conclusion of our study and it is unclear to me what actions can be taken, based on your comment",Why not use PubPeer (other) — cit167_2,no-serious-consequence,open-ended survey (qualitative),Why not use PubPeer (other),Zenodo 10.5281/zenodo.20413424 — PubPeer perceptions (qualitative)
Q4noWontOtherR_8tFDjsFvpMP19OR,The corresponding author of the paper has responded.,Why not use PubPeer (other) — cit540_2,pb-fixed-on-pubpeer,open-ended survey (qualitative),Why not use PubPeer (other),Zenodo 10.5281/zenodo.20413424 — PubPeer perceptions (qualitative)
Q4noWontOtherR_8ugeaWmdiA7xttL,The figure was corrected.,Why not use PubPeer (other) — cit541_2,correction-done,open-ended survey (qualitative),Why not use PubPeer (other),Zenodo 10.5281/zenodo.20413424 — PubPeer perceptions (qualitative)
Q4noWontOtherR_8yA7GeQyU3LuBCF,The comments do not hurt the paper. It is still valid.,Why not use PubPeer (other) — cit542_2,no-serious-consequence,open-ended survey (qualitative),Why not use PubPeer (other),Zenodo 10.5281/zenodo.20413424 — PubPeer perceptions (qualitative)
